{
  "audit": {
    "generated_candidates": 1,
    "raw_finding_count_reward": 0,
    "rejected_candidates": 0
  },
  "diagnostics": [],
  "findings": [
    {
      "blocking": false,
      "blocking_reason": "Below evidence threshold.",
      "citation": {
        "commit": "2222222222222222222222222222222222222222",
        "end_line": 12,
        "kind": "current_code",
        "path": "src/token.py",
        "start_line": 12,
        "target_hash": "sha256:aaaaaaaaaaaaaaaaaaaaaaaaaaaaaaaaaaaaaaaaaaaaaaaaaaaaaaaaaaaaaaaa"
      },
      "classification": "pre_existing_defect",
      "confidence": 95,
      "control_probe": {
        "artifacts": [
          "artifacts/control.txt"
        ],
        "command": "pytest -q test_null_token.py",
        "environment": "isolated fixture",
        "executed": true,
        "exit_code": 1,
        "expected": "pass",
        "expected_behavior_source": "independent regression specification",
        "identity": "BASE",
        "kind": "base_sha",
        "observed": "fail"
      },
      "cwe": [
        "CWE-476"
      ],
      "evidence_status": "reproduced",
      "fingerprint": "sha256:6f0942977136f1894b589ad560551127ba3780e337968dfa7562a1712cbda771",
      "help_uri": "https://cwe.mitre.org/data/definitions/476.html",
      "id": "adv-preexisting",
      "impact": "high",
      "likelihood": "likely",
      "preconditions": [
        "payment.token omitted"
      ],
      "priority": "P1",
      "related_locations": [
        {
          "line": 30,
          "path": "src/api.py"
        }
      ],
      "rule_id": "ADV-NULL-TOKEN",
      "suppression": "none",
      "target_probe": {
        "artifacts": [
          "artifacts/target.txt"
        ],
        "command": "pytest -q test_null_token.py",
        "environment": "isolated fixture",
        "executed": true,
        "exit_code": 1,
        "expected": "pass",
        "identity": "HEAD",
        "observed": "fail"
      },
      "title": "Null payment token crashes checkout"
    }
  ],
  "outcome": "completed",
  "residual_risks": [],
  "run": {
    "base_sha": "1111111111111111111111111111111111111111",
    "head_sha": "2222222222222222222222222222222222222222",
    "limitations": [],
    "model": {
      "name": "frozen",
      "provider": "fixture",
      "version": "1"
    },
    "prompt": {
      "name": "adversarial-reviewer",
      "sha256": "sha256:bbbbbbbbbbbbbbbbbbbbbbbbbbbbbbbbbbbbbbbbbbbbbbbbbbbbbbbbbbbbbbbb",
      "version": "1.0.0"
    },
    "repository": "https://example.invalid/repo",
    "reviewed_paths": [
      "src/token.py"
    ],
    "target": {
      "content_hash": "sha256:aaaaaaaaaaaaaaaaaaaaaaaaaaaaaaaaaaaaaaaaaaaaaaaaaaaaaaaaaaaaaaaa",
      "kind": "git_diff"
    },
    "tools": [
      {
        "name": "pytest",
        "version": "fixture"
      }
    ]
  },
  "schema_version": "1.0.0",
  "scope": {
    "bugs": {
      "status": "examined"
    },
    "existing_findings": {
      "reason": "No prior findings supplied.",
      "status": "not_applicable"
    },
    "hostile_input": {
      "status": "examined"
    },
    "security": {
      "status": "examined"
    }
  },
  "threat_model": {
    "abuse_cases": [
      "malformed token"
    ],
    "actors": [
      "remote caller"
    ],
    "applicability": "applicable",
    "assets": [
      "request integrity"
    ],
    "deployment_assumptions": [
      "isolated test environment"
    ],
    "entry_points": [
      "API"
    ],
    "out_of_scope": [],
    "privileges": [
      "untrusted"
    ],
    "security_objectives": [
      "fail safely"
    ],
    "taxonomy": [
      {
        "class": "authorization",
        "status": "examined"
      },
      {
        "class": "injection",
        "status": "examined"
      },
      {
        "class": "paths_files",
        "reason": "Not relevant to this fixture.",
        "status": "not_applicable"
      },
      {
        "class": "secrets",
        "status": "examined"
      },
      {
        "class": "deserialization",
        "reason": "Not relevant to this fixture.",
        "status": "not_applicable"
      },
      {
        "class": "ssrf",
        "reason": "Not relevant to this fixture.",
        "status": "not_applicable"
      },
      {
        "class": "resource_exhaustion",
        "status": "examined"
      },
      {
        "class": "races_state",
        "status": "examined"
      }
    ],
    "trust_boundaries": [
      "HTTP to application"
    ],
    "unknowns": []
  },
  "verdict": "ready_with_fixes"
}
